sprint_number,start_date,end_date,sprint_goal,planned_story_points,completed_story_points,velocity_delta,key_deliverables,blockers,notes
1,2025-07-21,2025-08-01,Project setup and authentication scaffold,21,18,-14.3%,"Repository setup, Node.js/TypeScript config, Prisma ORM init, JWT auth scaffold, Git workflows, CI/CD baseline","None identified","Fast ramp-up, smooth collaboration. Team established baseline velocity."
2,2025-08-04,2025-08-15,CRUD operations and dashboard shell,24,22,-8.3%,"Sensor CRUD endpoints, User CRUD, Role-based access control, Dashboard component library, Basic data tables","Minor: Design feedback on dashboard layout","Good momentum. Velocity: 22/24 points. Dashboard shell complete and validated."
3,2025-08-18,2025-08-29,Sensor integration and MQTT setup,26,14,-46.2%,"MQTT broker integration attempt, Helion payload parser, Sensor data ingestion, Real-time dashboard prototype","Critical: Helion firmware documentation unavailable. MQTT broker compatibility issues. Payload schema ambiguity.","Major velocity drop. Blocker: Helion vendor non-responsive. Pivot to reverse-engineering required."
4,2025-09-01,2025-09-12,MQTT workarounds and offline mode,20,16,-20.0%,"MQTT workaround implementation, Offline mode MVP, Message queue (Bull), Reverse-engineered payload parser, Sensor reconnection logic","Minor: Offline cache persistence edge cases","Recovery sprint. Reverse-engineering strategy validated in Milan field testing (Sep 10-12)."
5,2025-09-15,2025-09-26,Field testing and sensor dashboard,22,20,-9.1%,"Sensor dashboard with real-time data, Field testing expansion (Milan + Verona), Data deduplication fix, Performance optimization","Minor: Wi-Fi connectivity variance at Verona site","Strong velocity recovery. Field-tested payloads validated architecture. Team confidence restored."
6,2025-09-29,2025-10-10,Compliance and PDF generation,24,21,-12.5%,"Compliance report generator, PDF export module, CASL consent tracking, Audit logging, Report templates","None critical","Retro skipped due to crunch (noted). 21/24 points delivered. Compliance framework solid."
7,2025-10-13,2025-10-24,MVP polish and refactoring,20,19,-5.0%,"CASL refactor for clarity, Load testing (500 concurrent), UI/UX polish, Performance tuning, Documentation sprint","None","Strong finish. 19/20 points. Team dinner Oct 18. Launch-ready state."
8,2025-10-27,2025-11-07,UAT and launch preparation,15,13,-13.3%,"UAT execution with client, Bug fixes (5 critical, 12 minor), Launch checklist, Handover documentation, Deployment procedures","Minor: 2 UAT edge cases discovered late","Final sprint. 13/15 points. System stable. Knowledge transfer complete."
